
*** Running vivado
    with args -log fir_filter.vdi -applog -m64 -product Vivado -messageDb vivado.pb -mode batch -source fir_filter.tcl -notrace



****** Vivado v2021.2 (64-bit)
  **** SW Build 3367213 on Tue Oct 19 02:48:09 MDT 2021
  **** IP Build 3369179 on Thu Oct 21 08:25:16 MDT 2021
    ** Copyright 1986-2021 Xilinx, Inc. All Rights Reserved.

source fir_filter.tcl -notrace
Command: link_design -top fir_filter -part xc7a100tcsg324-1
Design is defaulting to srcset: sources_1
Design is defaulting to constrset: constrs_1
INFO: [Device 21-403] Loading part xc7a100tcsg324-1
Netlist sorting complete. Time (s): cpu = 00:00:00 ; elapsed = 00:00:00.005 . Memory (MB): peak = 1261.020 ; gain = 0.000
INFO: [Netlist 29-17] Analyzing 63 Unisim elements for replacement
INFO: [Netlist 29-28] Unisim Transformation completed in 0 CPU seconds
INFO: [Project 1-479] Netlist was created with Vivado 2021.2
INFO: [Project 1-570] Preparing netlist for logic optimization
Netlist sorting complete. Time (s): cpu = 00:00:00 ; elapsed = 00:00:00 . Memory (MB): peak = 1261.020 ; gain = 0.000
INFO: [Project 1-111] Unisim Transformation Summary:
No Unisim elements were transformed.

6 Infos, 0 Warnings, 0 Critical Warnings and 0 Errors encountered.
link_design completed successfully
link_design: Time (s): cpu = 00:00:05 ; elapsed = 00:00:06 . Memory (MB): peak = 1261.020 ; gain = 0.000
Command: opt_design
Attempting to get a license for feature 'Implementation' and/or device 'xc7a100t'
INFO: [Common 17-349] Got license for feature 'Implementation' and/or device 'xc7a100t'
Running DRC as a precondition to command opt_design

Starting DRC Task
INFO: [DRC 23-27] Running DRC with 2 threads
INFO: [Project 1-461] DRC finished with 0 Errors
INFO: [Project 1-462] Please refer to the DRC report (report_drc) for more information.

Time (s): cpu = 00:00:01 ; elapsed = 00:00:01 . Memory (MB): peak = 1261.020 ; gain = 0.000

Starting Cache Timing Information Task
INFO: [Timing 38-35] Done setting XDC timing constraints.
Ending Cache Timing Information Task | Checksum: 1414c4eb8

Time (s): cpu = 00:00:08 ; elapsed = 00:00:08 . Memory (MB): peak = 1438.512 ; gain = 177.492

Starting Logic Optimization Task

Phase 1 Retarget
INFO: [Opt 31-138] Pushed 0 inverter(s) to 0 load pin(s).
INFO: [Opt 31-49] Retargeted 0 cell(s).
Phase 1 Retarget | Checksum: 1414c4eb8

Time (s): cpu = 00:00:00 ; elapsed = 00:00:00.110 . Memory (MB): peak = 1724.859 ; gain = 0.000
INFO: [Opt 31-389] Phase Retarget created 0 cells and removed 0 cells

Phase 2 Constant propagation
INFO: [Opt 31-138] Pushed 0 inverter(s) to 0 load pin(s).
Phase 2 Constant propagation | Checksum: 7efc7d28

Time (s): cpu = 00:00:00 ; elapsed = 00:00:00.123 . Memory (MB): peak = 1724.859 ; gain = 0.000
INFO: [Opt 31-389] Phase Constant propagation created 0 cells and removed 0 cells

Phase 3 Sweep
Phase 3 Sweep | Checksum: 5db8bbd4

Time (s): cpu = 00:00:00 ; elapsed = 00:00:00.134 . Memory (MB): peak = 1724.859 ; gain = 0.000
INFO: [Opt 31-389] Phase Sweep created 0 cells and removed 0 cells

Phase 4 BUFG optimization
Phase 4 BUFG optimization | Checksum: 5db8bbd4

Time (s): cpu = 00:00:00 ; elapsed = 00:00:00.158 . Memory (MB): peak = 1724.859 ; gain = 0.000
INFO: [Opt 31-662] Phase BUFG optimization created 0 cells of which 0 are BUFGs and removed 0 cells.

Phase 5 Shift Register Optimization
INFO: [Opt 31-1064] SRL Remap converted 0 SRLs to 0 registers and converted 0 registers of register chains to 0 SRLs
Phase 5 Shift Register Optimization | Checksum: 5db8bbd4

Time (s): cpu = 00:00:00 ; elapsed = 00:00:00.160 . Memory (MB): peak = 1724.859 ; gain = 0.000
INFO: [Opt 31-389] Phase Shift Register Optimization created 0 cells and removed 0 cells

Phase 6 Post Processing Netlist
Phase 6 Post Processing Netlist | Checksum: 5db8bbd4

Time (s): cpu = 00:00:00 ; elapsed = 00:00:00.162 . Memory (MB): peak = 1724.859 ; gain = 0.000
INFO: [Opt 31-389] Phase Post Processing Netlist created 0 cells and removed 0 cells
Opt_design Change Summary
=========================


-------------------------------------------------------------------------------------------------------------------------
|  Phase                        |  #Cells created  |  #Cells Removed  |  #Constrained objects preventing optimizations  |
-------------------------------------------------------------------------------------------------------------------------
|  Retarget                     |               0  |               0  |                                              0  |
|  Constant propagation         |               0  |               0  |                                              0  |
|  Sweep                        |               0  |               0  |                                              0  |
|  BUFG optimization            |               0  |               0  |                                              0  |
|  Shift Register Optimization  |               0  |               0  |                                              0  |
|  Post Processing Netlist      |               0  |               0  |                                              0  |
-------------------------------------------------------------------------------------------------------------------------



Starting Connectivity Check Task

Time (s): cpu = 00:00:00 ; elapsed = 00:00:00.002 . Memory (MB): peak = 1724.859 ; gain = 0.000
Ending Logic Optimization Task | Checksum: 1c23da004

Time (s): cpu = 00:00:00 ; elapsed = 00:00:00.202 . Memory (MB): peak = 1724.859 ; gain = 0.000

Starting Power Optimization Task
INFO: [Pwropt 34-132] Skipping clock gating for clocks with a period < 2.00 ns.
Ending Power Optimization Task | Checksum: 1c23da004

Time (s): cpu = 00:00:00 ; elapsed = 00:00:00.082 . Memory (MB): peak = 1724.859 ; gain = 0.000

Starting Final Cleanup Task
Ending Final Cleanup Task | Checksum: 1c23da004

Time (s): cpu = 00:00:00 ; elapsed = 00:00:00 . Memory (MB): peak = 1724.859 ; gain = 0.000

Starting Netlist Obfuscation Task
Netlist sorting complete. Time (s): cpu = 00:00:00 ; elapsed = 00:00:00 . Memory (MB): peak = 1724.859 ; gain = 0.000
Ending Netlist Obfuscation Task | Checksum: 1c23da004

Time (s): cpu = 00:00:00 ; elapsed = 00:00:00 . Memory (MB): peak = 1724.859 ; gain = 0.000
INFO: [Common 17-83] Releasing license: Implementation
23 Infos, 0 Warnings, 0 Critical Warnings and 0 Errors encountered.
opt_design completed successfully
opt_design: Time (s): cpu = 00:00:12 ; elapsed = 00:00:13 . Memory (MB): peak = 1724.859 ; gain = 463.840
INFO: [Common 17-1381] The checkpoint 'C:/Users/ALUMNOS/Desktop/5/P5_AT_GV_JF_DASF_B/P5_AT_GV_JF_DASF_B.runs/impl_1/fir_filter_opt.dcp' has been generated.
INFO: [runtcl-4] Executing : report_drc -file fir_filter_drc_opted.rpt -pb fir_filter_drc_opted.pb -rpx fir_filter_drc_opted.rpx
Command: report_drc -file fir_filter_drc_opted.rpt -pb fir_filter_drc_opted.pb -rpx fir_filter_drc_opted.rpx
INFO: [IP_Flow 19-234] Refreshing IP repositories
INFO: [IP_Flow 19-1704] No user IP repositories specified
INFO: [IP_Flow 19-2313] Loaded Vivado IP repository 'C:/Xilinx/Vivado/2021.2/data/ip'.
INFO: [Timing 38-35] Done setting XDC timing constraints.
INFO: [DRC 23-27] Running DRC with 2 threads
INFO: [Vivado_Tcl 2-168] The results of DRC are in file C:/Users/ALUMNOS/Desktop/5/P5_AT_GV_JF_DASF_B/P5_AT_GV_JF_DASF_B.runs/impl_1/fir_filter_drc_opted.rpt.
report_drc completed successfully
Command: place_design
Attempting to get a license for feature 'Implementation' and/or device 'xc7a100t'
INFO: [Common 17-349] Got license for feature 'Implementation' and/or device 'xc7a100t'
INFO: [DRC 23-27] Running DRC with 2 threads
INFO: [Vivado_Tcl 4-198] DRC finished with 0 Errors
INFO: [Vivado_Tcl 4-199] Please refer to the DRC report (report_drc) for more information.
Running DRC as a precondition to command place_design
INFO: [DRC 23-27] Running DRC with 2 threads
INFO: [Vivado_Tcl 4-198] DRC finished with 0 Errors
INFO: [Vivado_Tcl 4-199] Please refer to the DRC report (report_drc) for more information.

Starting Placer Task
INFO: [Place 30-611] Multithreading enabled for place_design using a maximum of 2 CPUs

Phase 1 Placer Initialization

Phase 1.1 Placer Initialization Netlist Sorting
Netlist sorting complete. Time (s): cpu = 00:00:00 ; elapsed = 00:00:00 . Memory (MB): peak = 1764.973 ; gain = 0.000
Phase 1.1 Placer Initialization Netlist Sorting | Checksum: d78d666e

Time (s): cpu = 00:00:00 ; elapsed = 00:00:00.094 . Memory (MB): peak = 1764.973 ; gain = 0.000
Netlist sorting complete. Time (s): cpu = 00:00:00 ; elapsed = 00:00:00 . Memory (MB): peak = 1764.973 ; gain = 0.000

Phase 1.2 IO Placement/ Clock Placement/ Build Placer Device
Phase 1.2 IO Placement/ Clock Placement/ Build Placer Device | Checksum: 11ce4e37b

Time (s): cpu = 00:00:01 ; elapsed = 00:00:00.624 . Memory (MB): peak = 1764.973 ; gain = 0.000

Phase 1.3 Build Placer Netlist Model
Phase 1.3 Build Placer Netlist Model | Checksum: 1aaa4ee86

Time (s): cpu = 00:00:01 ; elapsed = 00:00:00.766 . Memory (MB): peak = 1764.973 ; gain = 0.000

Phase 1.4 Constrain Clocks/Macros
Phase 1.4 Constrain Clocks/Macros | Checksum: 1aaa4ee86

Time (s): cpu = 00:00:01 ; elapsed = 00:00:00.771 . Memory (MB): peak = 1764.973 ; gain = 0.000
Phase 1 Placer Initialization | Checksum: 1aaa4ee86

Time (s): cpu = 00:00:01 ; elapsed = 00:00:00.799 . Memory (MB): peak = 1764.973 ; gain = 0.000

Phase 2 Global Placement

Phase 2.1 Floorplanning
Phase 2.1 Floorplanning | Checksum: 1aaa4ee86

Time (s): cpu = 00:00:01 ; elapsed = 00:00:00.808 . Memory (MB): peak = 1764.973 ; gain = 0.000

Phase 2.2 Update Timing before SLR Path Opt
Phase 2.2 Update Timing before SLR Path Opt | Checksum: 1aaa4ee86

Time (s): cpu = 00:00:01 ; elapsed = 00:00:00.808 . Memory (MB): peak = 1764.973 ; gain = 0.000

Phase 2.3 Post-Processing in Floorplanning
Phase 2.3 Post-Processing in Floorplanning | Checksum: 1aaa4ee86

Time (s): cpu = 00:00:01 ; elapsed = 00:00:00.809 . Memory (MB): peak = 1764.973 ; gain = 0.000

Phase 2.4 Global Placement Core
WARNING: [Place 46-29] place_design is not in timing mode. Skip physical synthesis in placer
Phase 2.4 Global Placement Core | Checksum: 156e57199

Time (s): cpu = 00:00:04 ; elapsed = 00:00:02 . Memory (MB): peak = 1764.973 ; gain = 0.000
Phase 2 Global Placement | Checksum: 156e57199

Time (s): cpu = 00:00:04 ; elapsed = 00:00:02 . Memory (MB): peak = 1764.973 ; gain = 0.000

Phase 3 Detail Placement

Phase 3.1 Commit Multi Column Macros
Phase 3.1 Commit Multi Column Macros | Checksum: 156e57199

Time (s): cpu = 00:00:04 ; elapsed = 00:00:02 . Memory (MB): peak = 1764.973 ; gain = 0.000

Phase 3.2 Commit Most Macros & LUTRAMs
Phase 3.2 Commit Most Macros & LUTRAMs | Checksum: 10a2304fd

Time (s): cpu = 00:00:04 ; elapsed = 00:00:02 . Memory (MB): peak = 1764.973 ; gain = 0.000

Phase 3.3 Area Swap Optimization
Phase 3.3 Area Swap Optimization | Checksum: c4c2a66c

Time (s): cpu = 00:00:04 ; elapsed = 00:00:02 . Memory (MB): peak = 1764.973 ; gain = 0.000

Phase 3.4 Pipeline Register Optimization
Phase 3.4 Pipeline Register Optimization | Checksum: c4c2a66c

Time (s): cpu = 00:00:04 ; elapsed = 00:00:02 . Memory (MB): peak = 1764.973 ; gain = 0.000

Phase 3.5 Small Shape Detail Placement
Phase 3.5 Small Shape Detail Placement | Checksum: 1db1c0c99

Time (s): cpu = 00:00:04 ; elapsed = 00:00:02 . Memory (MB): peak = 1764.973 ; gain = 0.000

Phase 3.6 Re-assign LUT pins
Phase 3.6 Re-assign LUT pins | Checksum: 1db1c0c99

Time (s): cpu = 00:00:04 ; elapsed = 00:00:03 . Memory (MB): peak = 1764.973 ; gain = 0.000

Phase 3.7 Pipeline Register Optimization
Phase 3.7 Pipeline Register Optimization | Checksum: 1db1c0c99

Time (s): cpu = 00:00:04 ; elapsed = 00:00:03 . Memory (MB): peak = 1764.973 ; gain = 0.000
Phase 3 Detail Placement | Checksum: 1db1c0c99

Time (s): cpu = 00:00:04 ; elapsed = 00:00:03 . Memory (MB): peak = 1764.973 ; gain = 0.000

Phase 4 Post Placement Optimization and Clean-Up

Phase 4.1 Post Commit Optimization
Phase 4.1 Post Commit Optimization | Checksum: 1db1c0c99

Time (s): cpu = 00:00:04 ; elapsed = 00:00:03 . Memory (MB): peak = 1764.973 ; gain = 0.000

Phase 4.2 Post Placement Cleanup
Phase 4.2 Post Placement Cleanup | Checksum: 1db1c0c99

Time (s): cpu = 00:00:04 ; elapsed = 00:00:03 . Memory (MB): peak = 1764.973 ; gain = 0.000

Phase 4.3 Placer Reporting

Phase 4.3.1 Print Estimated Congestion
INFO: [Place 30-612] Post-Placement Estimated Congestion 
 ____________________________________________________
|           | Global Congestion | Short Congestion  |
| Direction | Region Size       | Region Size       |
|___________|___________________|___________________|
|      North|                1x1|                1x1|
|___________|___________________|___________________|
|      South|                1x1|                1x1|
|___________|___________________|___________________|
|       East|                1x1|                1x1|
|___________|___________________|___________________|
|       West|                1x1|                1x1|
|___________|___________________|___________________|

Phase 4.3.1 Print Estimated Congestion | Checksum: 1db1c0c99

Time (s): cpu = 00:00:04 ; elapsed = 00:00:03 . Memory (MB): peak = 1764.973 ; gain = 0.000
Phase 4.3 Placer Reporting | Checksum: 1db1c0c99

Time (s): cpu = 00:00:04 ; elapsed = 00:00:03 . Memory (MB): peak = 1764.973 ; gain = 0.000

Phase 4.4 Final Placement Cleanup
Netlist sorting complete. Time (s): cpu = 00:00:00 ; elapsed = 00:00:00 . Memory (MB): peak = 1764.973 ; gain = 0.000

Time (s): cpu = 00:00:04 ; elapsed = 00:00:03 . Memory (MB): peak = 1764.973 ; gain = 0.000
Phase 4 Post Placement Optimization and Clean-Up | Checksum: 2466de914

Time (s): cpu = 00:00:04 ; elapsed = 00:00:03 . Memory (MB): peak = 1764.973 ; gain = 0.000
Ending Placer Task | Checksum: 1cc5b8cf3

Time (s): cpu = 00:00:04 ; elapsed = 00:00:03 . Memory (MB): peak = 1764.973 ; gain = 0.000
INFO: [Common 17-83] Releasing license: Implementation
41 Infos, 1 Warnings, 0 Critical Warnings and 0 Errors encountered.
place_design completed successfully
Writing placer database...
Writing XDEF routing.
Writing XDEF routing logical nets.
Writing XDEF routing special nets.
Write XDEF Complete: Time (s): cpu = 00:00:01 ; elapsed = 00:00:00.138 . Memory (MB): peak = 1764.973 ; gain = 0.000
INFO: [Common 17-1381] The checkpoint 'C:/Users/ALUMNOS/Desktop/5/P5_AT_GV_JF_DASF_B/P5_AT_GV_JF_DASF_B.runs/impl_1/fir_filter_placed.dcp' has been generated.
INFO: [runtcl-4] Executing : report_io -file fir_filter_io_placed.rpt
report_io: Time (s): cpu = 00:00:00 ; elapsed = 00:00:00.055 . Memory (MB): peak = 1764.973 ; gain = 0.000
INFO: [runtcl-4] Executing : report_utilization -file fir_filter_utilization_placed.rpt -pb fir_filter_utilization_placed.pb
INFO: [runtcl-4] Executing : report_control_sets -verbose -file fir_filter_control_sets_placed.rpt
report_control_sets: Time (s): cpu = 00:00:00 ; elapsed = 00:00:00.002 . Memory (MB): peak = 1764.973 ; gain = 0.000
Command: phys_opt_design
Attempting to get a license for feature 'Implementation' and/or device 'xc7a100t'
INFO: [Common 17-349] Got license for feature 'Implementation' and/or device 'xc7a100t'
INFO: [Vivado_Tcl 4-235] No timing constraint found. The netlist was not modified.
INFO: [Common 17-83] Releasing license: Implementation
48 Infos, 1 Warnings, 0 Critical Warnings and 0 Errors encountered.
phys_opt_design completed successfully
Writing placer database...
Writing XDEF routing.
Writing XDEF routing logical nets.
Writing XDEF routing special nets.
Write XDEF Complete: Time (s): cpu = 00:00:00 ; elapsed = 00:00:00.063 . Memory (MB): peak = 1770.465 ; gain = 5.492
INFO: [Common 17-1381] The checkpoint 'C:/Users/ALUMNOS/Desktop/5/P5_AT_GV_JF_DASF_B/P5_AT_GV_JF_DASF_B.runs/impl_1/fir_filter_physopt.dcp' has been generated.
Command: route_design
Attempting to get a license for feature 'Implementation' and/or device 'xc7a100t'
INFO: [Common 17-349] Got license for feature 'Implementation' and/or device 'xc7a100t'
Running DRC as a precondition to command route_design
INFO: [DRC 23-27] Running DRC with 2 threads
INFO: [Vivado_Tcl 4-198] DRC finished with 0 Errors
INFO: [Vivado_Tcl 4-199] Please refer to the DRC report (report_drc) for more information.


Starting Routing Task
INFO: [Route 35-254] Multithreading enabled for route_design using a maximum of 2 CPUs

Phase 1 Build RT Design
Checksum: PlaceDB: f4ce2685 ConstDB: 0 ShapeSum: d78d666e RouteDB: 0

*** Running vivado
    with args -log fir_filter.vdi -applog -m64 -product Vivado -messageDb vivado.pb -mode batch -source fir_filter.tcl -notrace



****** Vivado v2022.2.2 (64-bit)
  **** SW Build 3788238 on Tue Feb 21 20:00:34 MST 2023
  **** IP Build 3783773 on Tue Feb 21 23:41:56 MST 2023
    ** Copyright 1986-2023 Xilinx, Inc. All Rights Reserved.

source fir_filter.tcl -notrace
create_project: Time (s): cpu = 00:00:07 ; elapsed = 00:00:07 . Memory (MB): peak = 378.871 ; gain = 58.809
Command: link_design -top fir_filter -part xck24-ubva530-2LV-c
Design is defaulting to srcset: sources_1
Design is defaulting to constrset: constrs_1
INFO: [Device 21-403] Loading part xck24-ubva530-2LV-c
WARNING: [Device 21-9] Clock region file  is not available
Netlist sorting complete. Time (s): cpu = 00:00:00 ; elapsed = 00:00:00.005 . Memory (MB): peak = 1344.922 ; gain = 0.000
INFO: [Netlist 29-17] Analyzing 83 Unisim elements for replacement
INFO: [Netlist 29-28] Unisim Transformation completed in 1 CPU seconds
INFO: [Project 1-479] Netlist was created with Vivado 2022.2.2
INFO: [Project 1-570] Preparing netlist for logic optimization
CRITICAL WARNING: [Device 21-2168] Failed to load clock programmable delays in NTD flow
Netlist sorting complete. Time (s): cpu = 00:00:00 ; elapsed = 00:00:00 . Memory (MB): peak = 1344.922 ; gain = 0.000
INFO: [Project 1-111] Unisim Transformation Summary:
  A total of 42 instances were transformed.
  IBUF => IBUF (IBUFCTRL, INBUF): 42 instances

6 Infos, 1 Warnings, 1 Critical Warnings and 0 Errors encountered.
link_design completed successfully
link_design: Time (s): cpu = 00:00:09 ; elapsed = 00:00:12 . Memory (MB): peak = 1344.922 ; gain = 961.477
Command: opt_design
Attempting to get a license for feature 'Implementation' and/or device 'xck24'
INFO: [Common 17-349] Got license for feature 'Implementation' and/or device 'xck24'
Running DRC as a precondition to command opt_design

Starting DRC Task
INFO: [DRC 23-27] Running DRC with 2 threads
INFO: [Project 1-461] DRC finished with 0 Errors
INFO: [Project 1-462] Please refer to the DRC report (report_drc) for more information.

Time (s): cpu = 00:00:02 ; elapsed = 00:00:01 . Memory (MB): peak = 1381.379 ; gain = 36.457

Starting Cache Timing Information Task
Ending Cache Timing Information Task | Checksum: 7eddad1e

Time (s): cpu = 00:00:00 ; elapsed = 00:00:00.013 . Memory (MB): peak = 1381.379 ; gain = 0.000
INFO: [Common 17-83] Releasing license: Implementation
11 Infos, 1 Warnings, 1 Critical Warnings and 1 Errors encountered.
opt_design failed
ERROR: [Common 17-577] Internal error: Cannot run timing on a non-timing device
INFO: [Common 17-206] Exiting Vivado at Wed May 22 17:19:51 2024...
